{
  "acImplemented": 14,
  "acLedger": {
    "acceptanceCriteria": [
      {
        "commits": [
          {
            "sha": "dbd9a655397fe390e86ef2fc78454813e229c29b",
            "step": 5
          }
        ],
        "evidence": [
          ".agents/skills/ws-fix-pr/README.md:L28-L28",
          ".agents/skills/ws-fix-pr/scripts/COOPERATIVE_FIX.md:L197-L197",
          ".agents/skills/ws-spec-provider-github/INTENTS.md:L13-L13",
          ".agents/skills/ws-spec-provider-github/scripts/fetch_threads.cjs:L55-L146",
          "test/test-fetch-threads-token-fallback.js:L1-L336"
        ],
        "files": [
          {
            "lineEnd": 28,
            "lineStart": 28,
            "path": ".agents/skills/ws-fix-pr/README.md",
            "sha256": "081f30949ec1b3cd39ff8acd16035b9c83a5eb2e901f4657ceb656b8d72deaa2"
          },
          {
            "lineEnd": 197,
            "lineStart": 197,
            "path": ".agents/skills/ws-fix-pr/scripts/COOPERATIVE_FIX.md",
            "sha256": "a4772fe835f5a62f5b4e8f6e606127d6d0de3af79281d5c086ef8a25563bcf41"
          },
          {
            "lineEnd": 13,
            "lineStart": 13,
            "path": ".agents/skills/ws-spec-provider-github/INTENTS.md",
            "sha256": "a9455d52c2872bf54638c2dd819de83189772e29c3ee1a99a4b4a92a26a6d1e2"
          },
          {
            "lineEnd": 146,
            "lineStart": 55,
            "path": ".agents/skills/ws-spec-provider-github/scripts/fetch_threads.cjs",
            "sha256": "a90999c7f3ba92799deb9b72c2cdb14b528fbd3c7005cb26163fbb4d42960c05"
          },
          {
            "lineEnd": 336,
            "lineStart": 1,
            "path": "test/test-fetch-threads-token-fallback.js",
            "sha256": "812e076d0f865ba42088a44164c4f471b56c03d7cb3db6a13def2a85b3872cf1"
          }
        ],
        "findings": [],
        "id": "AC1",
        "linkEventIds": [
          "g2-commit-dbd9a655397fe390e86ef2fc78454813e229c29b",
          "impl-us511-ac"
        ],
        "planSections": [
          "section-002",
          "section-003"
        ],
        "sabotage": {
          "exitCode": null,
          "required": false,
          "status": "not-required"
        },
        "status": "Implemented",
        "tasks": [],
        "tests": [
          {
            "alias": null,
            "exitCode": 0,
            "name": "AC1/AC2 env-token run exits 0",
            "phase": "observed",
            "sourceFile": "test/test-fetch-threads-token-fallback.js",
            "timestamp": "2026-10-13T04:18:57.524Z"
          },
          {
            "alias": null,
            "exitCode": 0,
            "name": "AC11 provider docs state the four-link chain",
            "phase": "observed",
            "sourceFile": "test/test-fetch-threads-token-fallback.js",
            "timestamp": "2026-10-13T04:18:57.526Z"
          },
          {
            "alias": null,
            "exitCode": 0,
            "name": "AC14 --json payload keeps key",
            "phase": "observed",
            "sourceFile": "test/test-fetch-threads-token-fallback.js",
            "timestamp": "2026-10-13T04:18:57.526Z"
          },
          {
            "alias": null,
            "exitCode": 0,
            "name": "AC2 env token short-circuits before",
            "phase": "observed",
            "sourceFile": "test/test-fetch-threads-token-fallback.js",
            "timestamp": "2026-10-13T04:18:57.525Z"
          },
          {
            "alias": null,
            "exitCode": 0,
            "name": "AC4 Authorization header carries the CLI token",
            "phase": "observed",
            "sourceFile": "test/test-fetch-threads-token-fallback.js",
            "timestamp": "2026-10-13T04:18:57.526Z"
          },
          {
            "alias": null,
            "exitCode": 0,
            "name": "CLI stderr is discarded",
            "phase": "observed",
            "sourceFile": "test/test-fetch-threads-token-fallback.js",
            "timestamp": "2026-10-13T04:18:57.526Z"
          },
          {
            "alias": null,
            "exitCode": 0,
            "name": "env token never printed on stdout/stderr",
            "phase": "observed",
            "sourceFile": "test/test-fetch-threads-token-fallback.js",
            "timestamp": "2026-10-13T04:18:57.526Z"
          },
          {
            "alias": null,
            "exitCode": 0,
            "name": "invoked after env miss",
            "phase": "observed",
            "sourceFile": "test/test-fetch-threads-token-fallback.js",
            "timestamp": "2026-10-13T04:18:57.525Z"
          },
          {
            "alias": null,
            "exitCode": 0,
            "name": "no-source run exits non-zero",
            "phase": "observed",
            "sourceFile": "test/test-fetch-threads-token-fallback.js",
            "timestamp": "2026-10-13T04:18:57.526Z"
          },
          {
            "alias": null,
            "exitCode": 0,
            "name": "shim does not duplicate token logic",
            "phase": "observed",
            "sourceFile": "test/test-fetch-threads-token-fallback.js",
            "timestamp": "2026-10-13T04:18:57.526Z"
          },
          {
            "alias": null,
            "exitCode": 0,
            "name": "shim propagates the canonical non-zero exit",
            "phase": "observed",
            "sourceFile": "test/test-fetch-threads-token-fallback.js",
            "timestamp": "2026-10-13T04:18:57.526Z"
          },
          {
            "alias": null,
            "exitCode": 0,
            "name": "stderr names the selected source",
            "phase": "observed",
            "sourceFile": "test/test-fetch-threads-token-fallback.js",
            "timestamp": "2026-10-13T04:18:57.526Z"
          },
          {
            "alias": null,
            "exitCode": 0,
            "name": "zero-thread message preserved",
            "phase": "observed",
            "sourceFile": "test/test-fetch-threads-token-fallback.js",
            "timestamp": "2026-10-13T04:18:57.526Z"
          },
          {
            "alias": null,
            "exitCode": 0,
            "name": "zero-thread text absent on failure",
            "phase": "observed",
            "sourceFile": "test/test-fetch-threads-token-fallback.js",
            "timestamp": "2026-10-13T04:18:57.526Z"
          }
        ],
        "text": "The canonical thread-fetch script shall resolve its GitHub token from `AGENTIC_CODE_REVIEWERS_GITHUB_TOKEN`, then `GITHUB_TOKEN`, then `GH_TOKEN`, then the `gh auth token` CLI fallback, in that order.",
        "verdicts": []
      },
      {
        "commits": [
          {
            "sha": "dbd9a655397fe390e86ef2fc78454813e229c29b",
            "step": 5
          }
        ],
        "evidence": [
          ".agents/skills/ws-fix-pr/README.md:L28-L28",
          ".agents/skills/ws-fix-pr/scripts/COOPERATIVE_FIX.md:L197-L197",
          ".agents/skills/ws-spec-provider-github/INTENTS.md:L13-L13",
          ".agents/skills/ws-spec-provider-github/scripts/fetch_threads.cjs:L55-L146",
          "test/test-fetch-threads-token-fallback.js:L1-L336"
        ],
        "files": [
          {
            "lineEnd": 28,
            "lineStart": 28,
            "path": ".agents/skills/ws-fix-pr/README.md",
            "sha256": "081f30949ec1b3cd39ff8acd16035b9c83a5eb2e901f4657ceb656b8d72deaa2"
          },
          {
            "lineEnd": 197,
            "lineStart": 197,
            "path": ".agents/skills/ws-fix-pr/scripts/COOPERATIVE_FIX.md",
            "sha256": "a4772fe835f5a62f5b4e8f6e606127d6d0de3af79281d5c086ef8a25563bcf41"
          },
          {
            "lineEnd": 13,
            "lineStart": 13,
            "path": ".agents/skills/ws-spec-provider-github/INTENTS.md",
            "sha256": "a9455d52c2872bf54638c2dd819de83189772e29c3ee1a99a4b4a92a26a6d1e2"
          },
          {
            "lineEnd": 146,
            "lineStart": 55,
            "path": ".agents/skills/ws-spec-provider-github/scripts/fetch_threads.cjs",
            "sha256": "a90999c7f3ba92799deb9b72c2cdb14b528fbd3c7005cb26163fbb4d42960c05"
          },
          {
            "lineEnd": 336,
            "lineStart": 1,
            "path": "test/test-fetch-threads-token-fallback.js",
            "sha256": "812e076d0f865ba42088a44164c4f471b56c03d7cb3db6a13def2a85b3872cf1"
          }
        ],
        "findings": [],
        "id": "AC2",
        "linkEventIds": [
          "g2-commit-dbd9a655397fe390e86ef2fc78454813e229c29b",
          "impl-us511-ac"
        ],
        "planSections": [
          "section-003"
        ],
        "sabotage": {
          "exitCode": null,
          "required": false,
          "status": "not-required"
        },
        "status": "Implemented",
        "tasks": [],
        "tests": [
          {
            "alias": null,
            "exitCode": 0,
            "name": "AC1/AC2 env-token run exits 0",
            "phase": "observed",
            "sourceFile": "test/test-fetch-threads-token-fallback.js",
            "timestamp": "2026-10-13T04:18:57.527Z"
          },
          {
            "alias": null,
            "exitCode": 0,
            "name": "AC11 provider docs state the four-link chain",
            "phase": "observed",
            "sourceFile": "test/test-fetch-threads-token-fallback.js",
            "timestamp": "2026-10-13T04:18:57.527Z"
          },
          {
            "alias": null,
            "exitCode": 0,
            "name": "AC14 --json payload keeps key",
            "phase": "observed",
            "sourceFile": "test/test-fetch-threads-token-fallback.js",
            "timestamp": "2026-10-13T04:18:57.527Z"
          },
          {
            "alias": null,
            "exitCode": 0,
            "name": "AC2 env token short-circuits before",
            "phase": "observed",
            "sourceFile": "test/test-fetch-threads-token-fallback.js",